元会社名,ステータス,新社名,変更日,変更理由,情報元URL,スニペット
会社名,未処理,不明,不明,不明,なし,
株式会社エス・イー・シー・ハイテック,未処理,不明,不明,不明,なし,
株式会社三井E&S DU,未処理,不明,不明,不明,なし,
株式会社マーブル,未処理,不明,不明,不明,なし,
平田機工株式会社,未処理,不明,不明,不明,なし,
日本金銭機械株式会社,未処理,不明,不明,不明,なし,
株式会社エリジオン,未処理,不明,不明,不明,なし,
新明和工業株式会社,未処理,不明,不明,不明,なし,
株式会社早川金属工業研究所 ,未処理,不明,不明,不明,なし,
松下電器産業株式会社 ,未処理,不明,不明,不明,なし,
株式会社ネクスト,未処理,不明,不明,不明,なし,
株式会社Sky,未処理,不明,不明,不明,なし,
新明和工業株式会社,未処理,不明,不明,不明,なし,
株式会社早川金属工業研究所 ,未処理,不明,不明,不明,なし,
株式会社ダイテック,未処理,不明,不明,不明,なし,
株式会社ダイコーテクノ,未処理,不明,不明,不明,なし,
株式会社早川金属工業研究所,未処理,不明,不明,不明,なし,
松下電器産業株式会社 ,未処理,不明,不明,不明,なし,
株式会社バルス,未処理,不明,不明,不明,なし,
株式会社島村呉服店,未処理,不明,不明,不明,なし,
株式会社福武式書店,変更なし,変更なし,変更日不明,不明,なし,なし
株式会社KUFU,未処理,不明,不明,不明,なし,
