会社名,新社名,変更日,変更理由,変更状況,検出文,URL
株式会社エス・イー・シー・ハイテック,変更なし,変更日不明,不明,変更なし,,
株式会社三井E&S DU,変更なし,変更日不明,不明,変更なし,,
株式会社マーブル,変更なし,変更日不明,不明,変更なし,,
平田機工株式会社,を別の名前,2024年12月7日,不明,変更あり,2024年12月7日 · 商号変更とは 商号変更とは、会社や法人が現在使用している名前（社名）を別の名前に変更することを指します。商号はその組織の「顔」であり、取引先や顧客からの認 …,https://reflet-office.com/trade_name/
日本金銭機械株式会社,変更なし,変更日不明,不明,変更なし,,
株式会社エリジオン,変更なし,変更日不明,不明,変更なし,,
新明和工業株式会社,変更なし,変更日不明,不明,変更なし,,
株式会社早川金属工業研究所 ,変更なし,変更日不明,不明,変更なし,,
松下電器産業株式会社 ,パナソニック株式会社,2008年6月26日,不明,変更あり,2008年6月26日 · 松下電器産業株式会社は、10月1日より社名を「パナソニック株式会社」に変更することを正式決定した。これは26日に行なわれた株主総会での ...,https://www.bing.com/ck/a?!&&p=4d489a1dfc0d7fe3e6c830a885d50cf3767dd65cacb547bf72d9889b8e3e7b06JmltdHM9MTc0ODQ3NjgwMA&ptn=3&ver=2&hsh=4&fclid=0e89b8da-433a-6099-00ab-ad26426861ad&u=a1aHR0cHM6Ly9rYWRlbi53YXRjaC5pbXByZXNzLmNvLmpwL2NkYS9uZXdzLzIwMDgvMDYvMjYvMjUwOS5odG1s&ntb=1
株式会社ネクスト,株式会社NEXT（ネクスト）,2024年10月1日,不明,変更あり,平素は格別のご高配を賜り、厚く御礼申し上げます。 このたび弊社は創業10周年を迎えるにあたり、社業のさらなる発展と、皆様と共に「次のフェーズへ進化させていく」という決意を込めて、2024年10月1日より社名を「株式会社NEXT（ネクスト）」へ変更いたしました。,https://nextjp.co.jp/next_shamei/
株式会社Sky,は2025年6月に社名をNTT株式会社,2025年6月,不明,変更あり,NTT（日本電信電話）は2025年6月に社名をNTT株式会社に変更予定。 dely株式会社 は2025年10月より クラシル株式会社 に名称を変更することを決定。 TOPPANグループ は2025年4月 …,https://www.genspark.ai/spark/%E4%BB%8A%E5%BE%8C%E3%81%AE%E7%A4%BE%E5%90%8D%E5%A4%89%E6%9B%B4%E4%BA%88%E5%AE%9A/6a78c529-3c55-433a-8cc8-744aa732bbc3
株式会社ダイテック,変更なし,変更日不明,不明,変更なし,,
株式会社ダイコーテクノ,変更なし,変更日不明,不明,変更なし,,
